{
  "schema_version": 1,
  "audited_at": "2026-08-27",
  "policy": "These records are pinned, licensed upstream examples for study and possible adaptation. They are not bundled, installable, approved for bootstrap, or permission to copy without preserving attribution and completing the listed promotion work.",
  "candidates": [
    {
      "id": "k-dense-venue-templates",
      "repository": "K-Dense-AI/scientific-agent-skills",
      "repository_url": "https://github.com/K-Dense-AI/scientific-agent-skills",
      "commit": "36d8f13a1e754618794bf42f417884940077b4ae",
      "skill_path": "skills/venue-templates",
      "skill_url": "https://github.com/K-Dense-AI/scientific-agent-skills/tree/36d8f13a1e754618794bf42f417884940077b4ae/skills/venue-templates",
      "license": "MIT",
      "license_url": "https://github.com/K-Dense-AI/scientific-agent-skills/blob/36d8f13a1e754618794bf42f417884940077b4ae/LICENSE.md",
      "capabilities": ["latex-and-venue-formatting"],
      "disposition": "take-candidate",
      "bundled": false,
      "rationale": "The strongest exact-skill candidate: venue scaffolds, bounded local helpers, focused tests, active maintenance, and a clean MIT license.",
      "risks": ["Venue rules change and must be rechecked against current official instructions."],
      "required_before_import": ["Review every bundled template and license notice.", "Run upstream tests and add Codex and Claude behavior evaluations."]
    },
    {
      "id": "orchestra-research-manager",
      "repository": "Orchestra-Research/AI-Research-SKILLs",
      "repository_url": "https://github.com/Orchestra-Research/AI-Research-SKILLs",
      "commit": "773a52944ba4747a18bd4ae9ade53fff041adcbc",
      "skill_path": "22-agent-native-research-artifact/research-manager",
      "skill_url": "https://github.com/Orchestra-Research/AI-Research-SKILLs/tree/773a52944ba4747a18bd4ae9ade53fff041adcbc/22-agent-native-research-artifact/research-manager",
      "license": "MIT",
      "license_url": "https://github.com/Orchestra-Research/AI-Research-SKILLs/blob/773a52944ba4747a18bd4ae9ade53fff041adcbc/LICENSE",
      "capabilities": ["research-log-and-decision-trail"],
      "disposition": "adapt-candidate",
      "bundled": false,
      "rationale": "Provides a useful passive event and provenance taxonomy for decisions, experiments, claims, dead ends, pivots, and human-versus-AI attribution.",
      "risks": ["The wider repository contains autonomous behavior that does not fit Evidence Lab human-accountability rules.", "The exact skill has no dedicated tests."],
      "required_before_import": ["Extract only the passive post-task logging contract.", "Add a deterministic event schema, validator, and representative behavior tests."]
    },
    {
      "id": "compound-science-reproducible-pipelines",
      "repository": "James-Traina/compound-science",
      "repository_url": "https://github.com/James-Traina/compound-science",
      "commit": "1ddb81fffbd95656322eed3577bee2080135d1af",
      "skill_path": "skills/reproducible-pipelines",
      "skill_url": "https://github.com/James-Traina/compound-science/tree/1ddb81fffbd95656322eed3577bee2080135d1af/skills/reproducible-pipelines",
      "license": "MIT",
      "license_url": "https://github.com/James-Traina/compound-science/blob/1ddb81fffbd95656322eed3577bee2080135d1af/LICENSE",
      "capabilities": ["reproducible-computation"],
      "disposition": "adapt-candidate",
      "bundled": false,
      "rationale": "A detailed source for environments, seeds, workflow managers, reruns, and replication packages despite its small repository adoption signal.",
      "risks": ["Examples are framed for economics and quantitative social science.", "One example cleanup target recursively deletes generated directories."],
      "required_before_import": ["Replace destructive cleanup examples with bounded recoverable operations.", "Reduce the method to a portable run manifest and add exact-skill tests."]
    },
    {
      "id": "appautomaton-arxiv-paper-writer",
      "repository": "appautomaton/latex-arxiv-SKILL",
      "repository_url": "https://github.com/appautomaton/latex-arxiv-SKILL",
      "commit": "349ce88a0797422911a4ce58ed335842e9b87e15",
      "skill_path": ".codex/skills/arxiv-paper-writer",
      "skill_url": "https://github.com/appautomaton/latex-arxiv-SKILL/tree/349ce88a0797422911a4ce58ed335842e9b87e15/.codex/skills/arxiv-paper-writer",
      "license": "MIT",
      "license_url": "https://github.com/appautomaton/latex-arxiv-SKILL/blob/349ce88a0797422911a4ce58ed335842e9b87e15/LICENSE",
      "capabilities": ["latex-and-venue-formatting", "academic-writing", "citation-management"],
      "disposition": "domain-extension",
      "bundled": false,
      "rationale": "A tested end-to-end example for an IEEE and arXiv review-paper workflow with templates, planning, compilation, validation, and citation checks.",
      "risks": ["It is opinionated for ML and AI review articles rather than universal scholarly publishing."],
      "required_before_import": ["Keep it optional and separate from the universal venue-formatting foundation.", "Review the bundled IEEE template and citation-network behavior."]
    },
    {
      "id": "aer-preregistration",
      "repository": "brycewang-stanford/AER-Skills",
      "repository_url": "https://github.com/brycewang-stanford/AER-Skills",
      "commit": "85eae99fe5935c79c209f597a56c88899082a090",
      "skill_path": "skills/aer-preregistration",
      "skill_url": "https://github.com/brycewang-stanford/AER-Skills/tree/85eae99fe5935c79c209f597a56c88899082a090/skills/aer-preregistration",
      "license": "MIT",
      "license_url": "https://github.com/brycewang-stanford/AER-Skills/blob/85eae99fe5935c79c209f597a56c88899082a090/LICENSE",
      "capabilities": ["preregistration"],
      "disposition": "domain-extension",
      "bundled": false,
      "rationale": "A substantive pre-analysis-plan example for prospective economics experiments, including an AEA-oriented template and repository test coverage.",
      "risks": ["AEA registry and economics-specific claims must not be generalized across disciplines."],
      "required_before_import": ["Use only as an economics domain extension.", "Revalidate all registry and venue requirements against current official sources."]
    },
    {
      "id": "wentor-pdf-extraction-guide",
      "repository": "wentorai/research-plugins",
      "repository_url": "https://github.com/wentorai/research-plugins",
      "commit": "bf44b3cd617fa94c8a1b254c5d1987142ca3d631",
      "skill_path": "skills/tools/document/pdf-extraction-guide",
      "skill_url": "https://github.com/wentorai/research-plugins/tree/bf44b3cd617fa94c8a1b254c5d1987142ca3d631/skills/tools/document/pdf-extraction-guide",
      "license": "MIT",
      "license_url": "https://github.com/wentorai/research-plugins/blob/bf44b3cd617fa94c8a1b254c5d1987142ca3d631/LICENSE",
      "capabilities": ["evidence-extraction", "document-normalization"],
      "disposition": "reference-only",
      "bundled": false,
      "rationale": "A broad comparison of PDF extraction approaches that can inform tool selection and edge-case coverage around the existing MarkItDown workflow.",
      "risks": ["The exact skill is prose-only and recommends direct dependency installation.", "It does not implement a claim-linked evidence artifact."],
      "required_before_import": ["Use only as research input for an original Evidence Lab evidence-card contract."]
    },
    {
      "id": "wentor-data-cleaning-pipeline",
      "repository": "wentorai/research-plugins",
      "repository_url": "https://github.com/wentorai/research-plugins",
      "commit": "bf44b3cd617fa94c8a1b254c5d1987142ca3d631",
      "skill_path": "skills/analysis/wrangling/data-cleaning-pipeline",
      "skill_url": "https://github.com/wentorai/research-plugins/tree/bf44b3cd617fa94c8a1b254c5d1987142ca3d631/skills/analysis/wrangling/data-cleaning-pipeline",
      "license": "MIT",
      "license_url": "https://github.com/wentorai/research-plugins/blob/bf44b3cd617fa94c8a1b254c5d1987142ca3d631/LICENSE",
      "capabilities": ["data-cleaning-and-provenance"],
      "disposition": "reference-only",
      "bundled": false,
      "rationale": "A readable catalogue of research-data cleaning stages that may inform coverage checks for the narrower Evidence Lab transformation ledger.",
      "risks": ["The exact skill has no dedicated deterministic scripts or tests."],
      "required_before_import": ["Do not import it as a second generic EDA skill; map only missing ledger requirements."]
    },
    {
      "id": "wentor-python-reproducibility-guide",
      "repository": "wentorai/research-plugins",
      "repository_url": "https://github.com/wentorai/research-plugins",
      "commit": "bf44b3cd617fa94c8a1b254c5d1987142ca3d631",
      "skill_path": "skills/tools/code-exec/python-reproducibility-guide",
      "skill_url": "https://github.com/wentorai/research-plugins/tree/bf44b3cd617fa94c8a1b254c5d1987142ca3d631/skills/tools/code-exec/python-reproducibility-guide",
      "license": "MIT",
      "license_url": "https://github.com/wentorai/research-plugins/blob/bf44b3cd617fa94c8a1b254c5d1987142ca3d631/LICENSE",
      "capabilities": ["reproducible-computation"],
      "disposition": "reference-only",
      "bundled": false,
      "rationale": "A useful comparison source for Python environment locking, seeds, notebooks, containers, and project structure.",
      "risks": ["It includes unpinned install commands, Docker recipes, and recursive cleanup examples.", "The exact skill has no dedicated tests."],
      "required_before_import": ["Use only to check conceptual coverage after the safe run-manifest contract is defined."]
    },
    {
      "id": "rosetta-research-data-management",
      "repository": "xjtulyc/awesome-rosetta-skills",
      "repository_url": "https://github.com/xjtulyc/awesome-rosetta-skills",